id_unit;id_word;part_of_speech;Word;Translation;Examples of sentences(1);Examples of sentences(2);Examples of sentences(3);Definition;Сollocations;Learned
12;104;ad;suitable;подходящий;Everybody can find a suitable job.;A suitable match for their daughter.;People who know many languages, are suitable to work in foreign countries.;acceptable or right for someone or something;;0
14;105;n;auditorium;аудитория, зрительный зал;You need to prepare an auditorium for upcoming conference.;Auditorium should be big enough to fit 100 people.;;the part of a theatre, or similar building, where the audience sit;;0
14;106;n;conference;конференция;The boss called us in for a conference.;There is a list of equupment we need for the conference.;;an event, sometimes lasting a few days, at which there is a group of talks on a particular subject, or a meeting in which especially business matters are discussed formally;to hold a conference, to speak at a conference;0
14;107;n;delegate;делегат, участник конференции;The number of delegated is 500.;There were a lot of delegates on this annual conference.;;a person chosen or elected by a group to speak, vote, etc. for them, especially at a meeting;;0
14;108;n;exhibitor;участник выставки;We need to find an appropriate place for stands for exibitors.;;;someone who has made or owns something, especially a work of art, shown in an exhibition;;0
14;109;ad;mutual;совместный, общий;I and my colleagues are working on a mutual project.;We are for mutual understanding.;;used to describe something that is done or felt by all or both people in a group;;0
14;110;n;projector;проектор;One of the projectors is broke. Check it, please.;They requested one project for the conference.;;a device for showing films or images on a screen or other surface;;0
14;111;v;to attend;участвовать;I will attend a conference this year for the first time.;Staff shoul attend all the meetings our boss chaired.;;to be at an event or go to a place;to attend a meeting;0
14;112;v;to distinguish;различать;I had recorded thes steps with a star, making it easier to distinguish them for notes;It is his Italian accent that distinguishes him.;;to notice or understand the difference between two things, or to make one person or thing seem different from another;to distinguish between two things, be distinguish from ;0
14;113;v;to broaden;расширять;This company need to broaden their product range. ;His business is broadenong more and more every year.;;to become wider, or to cause something to become wider;;0
14;114;v;to highlight;подчеркивать, выделять;On the conference I highlighted the most valuable thoughts in my notes.;Important names and dates in each chapter are highlighted.;;to attract attention to or emphasize something important;;0
15;115;n;agenda;повестка дня;It's not on today's agenda;I wonder if my request could be put forward on today's agenda.;What do you have on your agenda for tomorrow?;a list of matters to be discussed at a meeting;many important issues on the agenda;0
15;116;v;to complement;дополнять, дополнение;The colors complement each other.;It will most perfectly complement the pudding.;;to make something else seem better or more attractive when combining with it;complement to the meal;0
15;117;ad;productive;продуктивный;The sessions are productive;I see you've had a very productive day.;Senior year was very productive.;causing or providing a good result or a large amount of something;;0
15;118;n;chair;председатель;The chair is responsible for the success of a meeting;I think the budget chair might have a difficult time allowing a higher salary to be approved.;;a person in charge of a meeting, official group or organization;;0
15;119;v;to trim;урезать, уменьшать;Government has had to trim several vital services.;We have a lot of trimming to do, so we all have to work harder.;;to make something tidier or more level by cutting a small amount off it;to trim the costs;0
16;120;n;company jet;самолет компании;Executives from this company prefer using the company jet.;Private company jets are convenient because you can do your work during the flight.;;;;0
16;121;ad;non-retail ;оптовый;Some retailers may sell to business customers, and such sales are termed non-retail activity.;;;;;0
16;122;ad;potential;потенциальный;We can find potential customers on social media.;It is important to visit special conferences to find potential customers;;possible when the necessary conditions exist;;0
16;123;n;promotion manager;менеджер по продвижению;The job of promotion manager is visiting existing and potental customers.;It is important for promotional manager to visit as many customers as he could.;;;;0
16;124;v;to recommend;рекомендовать;I strongly recommend this product to solve preoblems with your skin.;Reasershers recommend to reduce number of international travel in order to save money.;;to suggest that someone or something would be good or suitable for a particular job or purpose, or to suggest that a particular action should be done;;0
16;125;n;representative;представитель;Today we met representatives of his company.;We should send the best representatives of our company to the conference.;;someone who speaks or does something officially for another person or group of people;;0
16;126;n;sales techniques;методы (приемы) продаж;There are several sales techniques used by salesmen.;If you want to sell a produsct, you need to have learn reliable sales tehniques.;;;;0
16;127;v;to suggest;предложить;I would like to suggest that we should spend more time for meeting customers intead writing reports.;I strongly suggest that you need to find training courses;;to mention an idea, possible plan, or action for other people to consider;to suggest an idea;0
17;128;v;to engage with;связаться с;You can't engage with her;Don't engage with those people.;;;;0
17;129;n;insight;проницительность, понимание;I thought you might be able to provide some insight.;Thanks for the insight;;(the ability to have) a clear, deep, and sometimes sudden understanding of a complicated problem or situation;to provide an insight into the world;0
17;130;n;next to nothing;почти ничего;Talent means next to nothing;We can get it for next to nothing.;;;;0
18;131;ad;appropriately;соответсвенно, подходяще;Once you have finished with the documents, recycle the paper appropriately.;However, I'm counting on you to respond appropriately.;;in a way that is suitable or right for a particular situation or occasion;;0
18;132;n;brainstorm;мозговой штурм;Get staff involved, perhaps by holding a brainstorming session.;I must have had a brainstorm that afternoon.;;to suggest a lot of ideas for a future activity very quickly before considering some of them more carefully;to hold a brainstorming session;0
18;133;ad;efficient;эффективный;Environmentally friendly offices are more efficient places to work.;Our new air conditioner is more efficient than our old one.;;working or operating quickly and effectively in an organized way;;0
18;134;v;to establish;установить;By redusing waste, a business can save money and establish itself as a socially responsible emloyer.;We need to establisg the cause of the ruin of the firm;;; to establish a business, to establish connection;0
18;135;ad;foreseeable;предвиденный, прогнозируемый;Accepting that printers will be with us for the foreseeable future.;This product will bring us a lot of money in foreseeable future.;;as far into the future as you can imagine or plan for;foreseeable future;0
18;136;n;foretelling;предсказание;Computer vendors were foretelling the death of the printer.;Market researches foretell the ruin of this company.;;to say what is going to happen in the future;;0
18;137;ad;idle;нерабочий, незанятый;Personal computer can stay idle foe a pre-determined time.;The equipment stood idle for a month.;;not working or being used;;0
19;138;n;absenteeism;прогулы;We cannot tolerate this kind of absenteeism amongst our junior staff;Two persons were dismissed for tax offences and absenteeism.;;a situation in which people are not at school or work when they should be;;0
19;139;v;to cut down on ;сократить;He should cut down on work-related stress;The only way to save our living space is to cut down on the number of private vehicles.;;;;0
19;140;n;rush hour;час пик;I hate the subway at rush hour;This rush hour traffic is not as bad as I thought.;;the busy part of the day when towns and cities are crowded, either in the morning when people are travelling to work, or in the evening when people are travelling home;;0
19;141;n;sick leave;больничный;Two guys are on sick leave;I ll give you two weeks of sick leave.;;time away from work because of illness;;0
19;142;n;staff turnover;текучка кадров;We get a lot of staff turnover;The second step was to determine the projected rate of staff turnover;;;;0
20;143;ad;redundant;избыточный, резервный;If you are a 100-user company you may need a redundant site and a lot of support.;Our boss made an employee redundant yesterday due to lack of budget.;; unnecessary because it is more than is needed;;0
20;144;n;attorney;адвокат;I have to retain an attorney to save my reputation.;If you want to take it further, you should consult an attorney.;;a lawyer;to arrange an attorney, to obtain an attorney, retain an attorney;0
20;145;n;salary;зарплата;He is on a salary of $4000 a month.;How much more do employees cost in addition to their salary?;;a fixed amount of money agreed every year as pay for an employee, usually paid directly into his or her bank account every month;monthly salary,  a raise in salary, to earn / get / receive a salary;0
20;146;n;contractor;подрядчик;Renovating the house involved hiring a contractor.;The contractor miscalculated the costs of rebuilding.;;a person or company that arranges to supply materials or workers for building or for moving goods;prime contractor, building contractor;0
20;147;ad;flexibility (flexible);гибкость, гибкий;In order to be succesful at work you need to be flexible.;Under the present system, we do not have any flexibility.;;the ability to change or be changed easily according to the situation;;0
20;148;n;offshoring;moving part of company to another country;One out of 10 lost manufacturing jobs was due to offshoring.;;;the practice of basing a business or part of a business in a different country, usually because this involves paying less tax or other costs;;0
20;149;n;outsourcing;employing side people to do part of the work ;Small-business owners tend to assume they can handle all functions rather than pay to outsource those functions.;The first layer of cost savings in outsourcing comes from payroll taxes.;;the process of paying to have part of a company's work done by another company;;0
20;150;v;to arise;возникать;When we came up with a solution, new problems arised.;New company with the same product arose on the market.;;to happen;;0
20;151;v;to tailor;подогнать, приспособить;We need to tailor to new rules on the market in order to succeed.;Treatment is tailored to the needs of each patient.;;to make something specially so that it is right for a particular person, organization, or purpose;;0
21;152;n;car dealership;автосалон;He runs a successful car dealership;I got salesman of the month at my car dealership.;;;;0
21;153;v;to deal with;иметь дело с ;And that makes me the only investor who can deal with this problem.;I can't deal with all these other people's lives.;;to talk to someone or meet someone, especially as part of your job;to deal with the workers;0
21;154;n;integrity;честность;It's important to have some kind of personal integrity;There is nothing I value more than integrity.;I didn't come here to question your integrity.;the quality of being honest and having strong moral principles that you refuse to change;;0
21;155;n;outcome;результат, исход;They will not affect the outcome.;The outcome of this match is still open.;;a result or effect of an action, situation;;0
21;156;n;responsiveness;реакция ;Your levels of responsiveness have decreased recently;He's showing signs of responsiveness.;;the quality of having a reaction to something or someone, especially a quick or positive reaction;;0
21;157;n;teamwork;командная работа;Teamwork: That's what counts in this organisation;We need teamwork to improve your English.;;the activity of working together in a group with other people, especially when this is successful;;0
22;158;n;empowerment;полномочие, расширение возможностей;He got a promotion, so he has more empowernment now.;After getting a degree you have more empowernment to choose a better job.;;the process of giving a group of people more freedom or rights;;0
22;159;v;to retain;удержать;This course is designed for anyone who wants to know how to retain customers.;She retains a attorney.;;to keep or continue to have something;;0
22;160;n;loyalty;лояльность;Complaints of customers that handeled properly can be converted into loyalty.;They felt no loyalty to a losing team.;;the quality of being loyal to a particular company or brand;;0
22;161;v;to repurchase;выкупить;Dagni repurchased that factory and find an novel arcitecture of motor in here.;We can repurchase this little building to create a shopping moll.;;to buy back shares, bonds, etc. that you previously sold;repurchase price, repurchase scheme;0
22;162;n;revenue;доход;Our yearly revenue are about 5 million roubles.;The factory lost revenue because of the strike by the workers.;;the income that a government or company receives regularly;government revenue, annual / yearly revenue;0
22;163;n;rival ;конкурент;He had respect for his rivals.;Rival company couldn't make a better advertising than ours.;;a person, group, etc. competing with others for the same thing or in the same area;rival team;0
22;164;n;supplier;поставщик;Our constant supplier went to our rivals. ;These vegetables are spoiled, we need to find a new supplier.;;a company, person, etc. that provides things that people want or need, especially over a long period of time;qualified supplier, software supplier;0
23;165;n;line manager;начальник; I'm going to ask Ms.Fell to come here, because she's my line manager;He is my line manager.;;the person who is directly responsible for managing the work of someone else in a company or business, and who is one level above that person;;0
24;166;ad;competent;компетентный;He is very competent in controversial questions.;The court is not competent to deal with this case.;;able to do something well;competent staff;0
24;167;ad;intercultural;межкультурный;State programmes also lack intercultural perspective.;It is important to be inteculturally competent.;;relating to or involving more than one culture;;0
24;168;ad;global;глобальный;The global warming is a crutial problem of today.;The global economy is a complex organism.;So where find suppliers: local or global?;relating to the whole world;global changes, global search;0
24;169;ad;international;интернациональный;RUDN is an international university.;We should be aware of international laws.;;involving more than one country;international law, international agencies;0
